Date Time,,,,Event
02/26/2021 06:00,UK,706),,BOE's Haldane Delivers Recorded Speech on Inflation
02/26/2021 07:30,UK,707),,BOE's Ramsden Speaks on Bank Resolution
03/03/2021 11:00,UK,708),,BOE's Tenreyro Speaks on Negative Rate Policies
03/05/2021 09:00,UK,709),,BOE's Haskel Speaks on a Panel
03/08/2021 05:00,UK,710),,BOE Governor Bailey Speaks on Economic Outlook
03/18/2021 07:00,UK,711),,BOE's Cunliffe Speaks at BIS Event
03/18/2021 08:30,UK,712),,BOE's Haldane Speaks at Women In Finance Awards
03/19/2021 09:00,UK,713),,BOE's Cunliffe Speaks at BIS Event
03/23/2021 04:40,UK,714),,BOE's Haldane Speaks on Panel
03/23/2021 05:55,UK,715),,BOE's Cunliffe Speaks on BIS Panel
03/23/2021 07:50,UK,716),,BOE Governor Bailey Speaks on Net Zero Panel
03/25/2021 03:00,UK,717),,BOE's Bailey Speaks at Banknote Unveiling
03/25/2021 05:30,UK,718),,BOE Governor Bailey Speaks on Central Bank Innovation
03/25/2021 06:00,UK,719),,BOE's Bailey Speaks on Virtual Q&A
03/26/2021 05:00,UK,720),,Bank of England Publishes Financial Policy Summary and Record
03/26/2021 08:00,UK,721),,BOE's Saunders Speaks on Webinar
03/26/2021 12:45,UK,722),,BOE's Tenreyro Speaks at San Francisco Fed Conference
04/12/2021 09:00,UK,723),,BOE's Tenreyro Speaks on Webinar
04/14/2021 10:30,UK,724),,BOE's Haskel Speaks on Webinar
04/16/2021 05:00,UK,725),,BOE's Woods Speaks on Webinar
04/16/2021,UK,726),,United Kingdom Sovereign Debt to be rated by Moody's
04/21/2021 04:05,UK,727),,BOE's Ramsden Speaks on Webinar
04/21/2021 06:30,UK,728),,BOE's Bailey Speaks at Diversity Event
04/23/2021,UK,729),,United Kingdom Sovereign Debt to be rated by S&P
05/07/2021 07:15,UK,730),,"BOE's Broadbent, Haldane Speak at Briefing"
05/11/2021 10:30,UK,731),,BOE Governor Bailey Speaks on Libor
05/12/2021 10:00,UK,732),,BOE Governor Bailey Speaks at ISDA Event
05/13/2021 08:00,UK,733),,BOE's Cunliffe Speaks on Digital Currencies
05/13/2021 12:00,UK,734),,"BOE's Bailey, Breeden Speak on Citizens' Panel"
05/17/2021 10:15,UK,735),,BOE's Tenreyro speaks.
05/17/2021 11:30,UK,736),,BOE's Vlieghe speaks.
05/17/2021 12:30,UK,737),,BOE's Haldane speaks.
05/18/2021 10:00,UK,738),,"BOE's Bailey, Broadbent and Ramsden speak."
05/20/2021 05:05,UK,739),,BOE's Cunliffe speaks.
05/21/2021 04:30,UK,740),,BOE's Hauser speaks
05/24/2021 10:30,UK,741),,"BOE's Bailey, Cunliffe, Haldane and Saunders address lawmakers"
05/25/2021 12:00,UK,742),,BOE's Tenreyro speaks.
05/27/2021 07:00,UK,743),,BOE's Vlieghe speaks
06/01/2021 11:00,UK,744),,BOE's Bailey speaks.
06/03/2021 12:00,UK,745),,BOE's Bailey speaks
06/18/2021,UK,746),,United Kingdom Sovereign Debt to be rated by Fitch
07/09/2021 06:00,UK,747),,BOE's Bailey speaks on panel with ECB's Lagarde
07/13/2021 02:00,UK,748),,BOE Publishes Financial Stability Report
07/13/2021 03:30,UK,749),,BOE's Bailey Speaks After Financial Stability Report
09/05/2021 19:10,UK,750),,BOE's Mann Speaks
09/07/2021 01:10,UK,751),,BOE's Mann Speaks
09/07/2021 03:30,UK,752),,BOE's Saunders Speaks
09/08/2021 11:00,UK,753),,"BOE's Bailey, Broadbent, Ramsden, Tenreyro and Hall Speak"
09/09/2021 07:00,FR,754),,Group of Seven finance ministers conference call
09/17/2021 08:00,UK,755),,BOE's Bailey on IMF panel about investment funds and stability
09/21/2021 05:00,EC,756),,OECD Publishes Interim Economic Outlook
10/13/2021 09:30,UK,757),,BOE's Cunliffe Speaks.
10/14/2021 10:40,UK,758),,BOE's Mann speaks.
10/15/2021,UK,759),,United Kingdom Sovereign Debt to be rated by Moody's
10/16/2021 09:00,US,760),,BOE's Andrew Bailey and PBOC's Yi Gang speak on panel
10/22/2021,UK,761),,United Kingdom Sovereign Debt to be rated by S&P
11/01/2021 07:00,UK,762),,U.K. OBR chiefs testify
11/01/2021 11:15,UK,763),,U.K. Chancellor of the Exchequer Rishi Sunak testifies
11/02/2021 11:00,UK,764),,U.K.'s Sunak testifies on budget
11/04/2021 08:30,UK,765),,BOE's Bailey speaks at press conference.
11/04/2021 13:50,UK,766),,BOE's Cunliffe speaks.
11/05/2021 08:15,UK,767),,"BOE's Ramsden, Pill speak."
11/05/2021 09:00,UK,768),,BOE policy maker Silvana Tenreyro in panel discussion
11/16/2021,US,769),,G-7 Finance Ministers Hold Virtual Meeting
11/23/2021 06:00,UK,770),,BOE's Haskel speaks on `high inflation now and then'
11/23/2021 10:00,UK,771),,"BOE's Bailey, Cunliffe at House of Lords"
11/24/2021 09:30,UK,772),,BOE's Tenreyro speaks at Oxford Economics Society
11/25/2021 09:05,UK,773),,BOE's Haskel gives introductory remarks at BOE/Niesr workshop
11/25/2021 12:30,UK,774),,BOE Governor Andrew Bailey speaks at Cambridge Union event
11/26/2021 08:00,UK,775),,Bank of England's Huw Pill speaks to CBI on economic outlook
11/30/2021 08:00,UK,776),,BOE's Mann speaks at event with Barclays
12/01/2021 09:00,UK,777),,BOE's Bailey speaks on insurance regulation
12/03/2021 06:00,UK,778),,BOE's Saunders speaks.
12/10/2021,UK,779),,United Kingdom Sovereign Debt to be rated by Fitch
01/28/2022 04:30,UK,780),,Inflation by household income
