Date Time,,,,Event
11/16/2017 09:00,UK,341),,"BOE's Carney, Broadbent, Cunliffe, Place, Ramsden, Woods Speak"
11/20/2017 13:30,UK,342),,BOE's Dave Ramsden speaks in London
11/21/2017 05:00,UK,343),,"Testimony from BOE's Cunliffe, McCafferty, Saunders, Vlieghe."
11/27/2017 09:30,UK,344),,"BOE's Haldane Speaks in Birmingham, England"
11/28/2017 02:30,UK,345),,Carney Speaks at Publication of Financial Stability Review
11/29/2017 09:00,UK,346),,BOE's Carney Speaks at FMSB Event in London
11/29/2017 09:45,UK,347),,BOE's Ramsden Speaks at FMSB Event in London
11/30/2017 13:10,UK,348),,BOE Financial Policy Committee's Sharp Speaks in London
12/06/2017 04:15,UK,349),,UK Brexit Secretary Davis Addresses Brexit Parliamentary...
12/14/2017 12/16,CH,350),,"China, U.K. Hold Economic and Financial Dialogue in Beijing"
12/15/2017 08:15,UK,351),,"BOE's Haldane speaks in Palermo, Italy"
12/15/2017,UK,352),,United Kingdom Sovereign Debt to be rated by DBRS
12/20/2017 08:15,UK,353),,Carney Speaks at Parliament Hearing in London
01/15/2018 13:15,UK,354),,BOE's Tenreyro Speaks on Productivity at Event in London
01/16/2018 04:15,UK,355),,"Woods, Boss and Yallop testify on PRA before U.K. lawmakers."
01/17/2018 06:45,UK,356),,BOE's Saunders Speaks at Event in London
01/25/2018,EC,357),,EU Commission Holds Seminar to Discuss Future Brexit Ties
01/26/2018 09:00,UK,358),,BOE Governor Mark Carney Speaks on a Panel at Davos
01/30/2018 10:30,UK,359),,Bank of England Governor Carney Speaks Before Lawmakers
02/01/2018 12:30,UK,360),,BOE's Brazier Speaks in London
02/08/2018 07:30,UK,361),,Carney Speaks at BOE Inflation Report Press Conference
02/09/2018 11:45,UK,362),,BOE's Cunliffe Speaks in California
02/12/2018 04:30,UK,363),,BOE's Vlieghe Speaks at Resolution Foundation Event in London
02/12/2018 11:30,UK,364),,BOE Policy Maker Ian McCafferty Speaks on LBC Radio
02/19/2018 13:45,UK,365),,BOE's Carney Speaks at Event in London
02/21/2018 09:15,UK,366),,"BOE's Carney, Broadbent, Haldane and Tenreyro Speak in London"
02/23/2018 07:00,UK,367),,BOE's Ramsden Speaks on Productivity in Cambridge
02/26/2018 13:00,UK,368),,BOE's Cunliffe Speaks at Event at Warwick University
02/27/2018 04:00,UK,369),,BOE's Sam Woods speaks in London
03/02/2018 05:00,UK,370),,Carney Speaks on Money at Event in London
03/02/2018,UK,371),,U.K. Prime Minister May Speeks on Britain and EU Post Brexit
03/06/2018 13:15,UK,372),,BOE's Haldane Speaks at Event in London
03/13/2018 08:30,UK,373),,Hammond Delivers Spring Statement
03/22/2018 13:00,UK,374),,BOE's Ramsden speaks in London.
03/23/2018 08:30,UK,375),,BOE's Vlieghe speaks in Birmingham.
03/26/2018 04:30,UK,376),,Record of Financial Policy Committee's March Meeting.
04/06/2018 11:15,UK,377),,BOE Governor Carney Speaks at Climate Conference in Amsterdam
04/10/2018 05:30,UK,378),,BOE's Haldane Speaks in Melbourne
04/12/2018 02:30,UK,379),,BOE's Broadbent Speaks in Sydney
04/12/2018 15:00,CA,380),,Mark Carney speaks at Canada Growth Summit in Toronto
04/18/2018 09:15,UK,381),,"BOE FPC's Brazier, Kohn and Taylor Testify to Lawmakers"
04/19/2018 06:10,UK,382),,BOE FPC's Brazier speaks in London
04/19/2018 12:30,UK,383),,BOE's Cunliffe speaks in Washington.
04/20/2018 05:30,UK,384),,BOE's Saunders speaks in Glasgow.
04/24/2018 03:00,UK,385),,BOE's Woods Speaks at Breakfast Briefing
04/24/2018 04:20,UK,386),,BOE's Andrew Hauser speaks on panel in London
04/24/2018 06:35,UK,387),,BOE Chief Cashier Cleland Moderates Panel on Cash
04/24/2018 09:10,UK,388),,BOE's Woods Speaks on Global Regulation in London
04/26/2018 04:30,UK,389),,BOE's Alex Brazier Speaks in London
04/27/2018 10:00,UK,390),,BOE's Carney Speaks in London
04/27/2018 10:15,UK,391),,BOE's Andy Haldane Chairs Panel in London
04/27/2018,UK,392),,United Kingdom Sovereign Debt to be rated by S&P
04/27/2018,UK,393),,United Kingdom Sovereign Debt to be rated by Fitch
04/30/2018 05:00,UK,394),,BOE Publishes Remarks From April 19 Haldane Speech
05/02/2018 05/04,EC,395),,"EU, U.K. Negotiators Begin Next Round of Brexit Talks"
05/10/2018 07:30,UK,396),,BOE Governor Mark Carney Holds Press Conference in London
05/14/2018 07:45,EC,397),,ECB's Praet Speaks in London
05/14/2018 12:15,EC,398),,ECB's Praet Speaks in London
05/16/2018 04:10,UK,399),,BOE's John Speaks on Benchmark Reform in Liverpool
05/17/2018 12:00,UK,400),,BOE Chief Economist Haldane Speaks in London
05/22/2018 04:15,UK,401),,BOE's Vlieghe Speaks at Parliament Reappointment Hearing
05/22/2018 04:15,UK,402),,"BOE's Carney, Ramsden, Saunders, Vlieghe Speak in London"
05/24/2018 03:00,UK,403),,"Carney, Dudley Speak at BOE Markets Forum in London"
05/24/2018 13:00,UK,404),,BOE's Carney Speaks at Event in London
05/25/2018 12:30,PO,405),,EU's Barnier Speaks at Debate on Brexit in Lisbon
05/31/2018 06/02,CA,406),,G-7 Finance Ministers and Central Bankers Meet in Whistler
06/04/2018 13:00,UK,407),,"BOE's Tenreyro Speaks at University of Surrey, England"
06/05/2018 06:00,UK,408),,"BOE's Cunliffe Speaks at Derivatives Conference, London"
06/06/2018 11:00,UK,409),,BOE's McCafferty Speaks on LBC Radio
06/07/2018 11:00,UK,410),,BOE's Ramsden Speaks at Conference in London
06/13/2018 13:15,UK,411),,Bank of England's Anil Kashyap Speaks in London
06/15/2018,UK,412),,United Kingdom Sovereign Debt to Be Rated by Moody's
06/21/2018 16:15,UK,413),,BOE Governor Mark Carney Delivers Mansion House Speech
06/26/2018 05:00,UK,414),,"Haskel, Fried Speak at BOE Appointment Hearings in London"
06/26/2018 05:30,UK,415),,BOE's McCafferty Speaks in London
06/27/2018 05:30,UK,416),,BOE's Carney Speaks About Financial Stability Report
06/28/2018 04:30,UK,417),,BOE publishes Agents Summary of Business Conditions
06/28/2018 06:00,UK,418),,BOE's Bailey Speaks on the Future of Payments in London
06/28/2018 09:30,UK,419),,BOE Chief Economist Andy Haldane Speaks in London
07/04/2018 04:05,UK,420),,BOE's Woods Speaks in London
07/04/2018 06:55,UK,421),,BOE's Saporta Speaks in London
07/05/2018 06:00,UK,422),,BOE Governor Carney Speaks in Newcastle
07/09/2018 03:50,UK,423),,BOE's Broadbent Speaks at Conference in London
07/10/2018 05:25,UK,424),,BOE Fintech Hub Head Cordelia Kafetz Speaks in London
07/13/2018 07:30,UK,425),,Bank of England Deputy Governor Jon Cunliffe Speaks in Kendal
07/17/2018 04:00,UK,426),,"BOE's Carney, Cunliffe, Stheeman Speak on Financial Stability"
07/21/2018 07/22,AR,427),,"G-20 Finance Ministers, Central Bankers Meet in Buenos Aires"
07/23/2018 13:00,UK,428),,BOE's Broadbent Speaks in London
07/27/2018 07/29,AR,429),,G-20 Agricultural Ministers Meet in Buenos Aires
08/02/2018 07:30,UK,430),,BOE's Carney speaks at press conference in London
08/07/2018 11:00,UK,431),,BOE's McCafferty Speaks on Radio Phone-In
09/04/2018 08:15,UK,432),,"BOE's Carney, Haldane and Tenreyro Speak Before Lawmakers"
09/13/2018 07:00,UK,433),,BOE's Agents Summary of Business Conditions
09/14/2018 06:00,UK,434),,BOE's Carney speaks in Dublin
09/19/2018 04:00,UK,435),,BOE's Haldane Speaks in Estonia
09/25/2018 04:40,UK,436),,BOE's Vlieghe Speaks in London
09/27/2018 07:45,UK,437),,BOE's Haldane Speaks in London
09/27/2018 10:00,UK,438),,BOE's Carney Chairs Panel in Frankfurt
09/28/2018 09:20,UK,439),,BOE's Ramsden Speaks in London
10/01/2018 10:50,UK,440),,BOE's Tenreyro Chairs Panel in London.
10/02/2018 04:45,UK,441),,BOE Chief Economist Haldane Chairs Panel in London
10/02/2018 06:35,UK,442),,BOE's Haskel Chairs Panel in London
10/09/2018 04:30,UK,443),,FPC Statement From its Meeting on Oct. 3.
10/09/2018 10:35,UK,444),,BOE's Broadbent Testifies to Parliament
10/10/2018 05:10,UK,445),,BOE's Haldane speaks in London.
10/11/2018 05:00,UK,446),,"BOE's Carney, ECB's Villeroy on Green Finance Panel in Bali"
10/17/2018 04:30,UK,447),,BOE's FPC Publishes Record of Its Oct. 3 Meeting
10/17/2018 09:15,UK,448),,BOE's Cunliffe Speaks Before Lawmakers in London
10/17/2018 13:00,UK,449),,BOE's Broadbent Speaks in Washington
10/19/2018 12:10,UK,450),,BOE Governor Carney Speaks in New York
10/23/2018 06:30,UK,451),,BOE Chief Economist Haldane Speaks in Paris
10/23/2018 11:20,UK,452),,Carney Speaks at a Conference in Toronto
10/26/2018,UK,453),,United Kingdom Sovereign Debt to be rated by S&P
10/26/2018,UK,454),,United Kingdom Sovereign Debt to be rated by Fitch
10/29/2018 11:30,UK,455),,TOPLive: U.K.'s Hammond Presents Budget
11/01/2018 08:30,UK,456),,BOE's Carney speaks at press conference in London
11/09/2018 13:30,UK,457),,"BOE's Haldane Speaks at Event in Bristol, England"
11/13/2018 03:00,EC,458),,ECB's Praet Speaks in London
11/20/2018 05:00,UK,459),,"BOE's Carney, Haldane, Cunliffe and Saunders Testify in London"
11/21/2018 10:15,UK,460),,Bank of England Governor Carney Speaks on Sustainability
11/22/2018 15:55,UK,461),,BOE Policy Maker Saunders Speaks
11/26/2018 13:30,UK,462),,"BOE Governor Carney, former Fed Chairman Greenspan Speak"
11/28/2018 11:30,UK,463),,"BOE Publishes Brexit Analysis, Financial Stability Report"
11/28/2018 11:45,UK,464),,BOE's Carney Speaks at FSR Press Conference in London
12/03/2018 10:00,UK,465),,FCA Chief Executive Bailey Speaks in U.K. Parliament
12/04/2018 04:15,UK,466),,BOE Governor Carney Speaks at U.K. Parliament
12/04/2018 13:00,UK,467),,BOE's Vlieghe Speaks in Plymouth
12/06/2018 05:00,UK,468),,BOE's Ramsden Speaks in London
12/07/2018,UK,469),,United Kingdom Sovereign Debt to Be Rated by Moody's
12/12/2018 15:00,UK,470),,Confidence Vote in U.K. Prime Minister May
01/09/2019 10:30,UK,471),,BOE Governor Carney Participates in Online Q&A
01/16/2019 04:15,UK,472),,BOE Governor Carney Testifies on Financial Stability Report
01/23/2019 04:30,UK,473),,BOE's Broadbent Speaks in London
01/28/2019 09:30,UK,474),,"BOE's Carney, Broadbent, Ramsden and Place speak at event."
01/29/2019 04:15,UK,475),,BOE's Woods Speaks on Financial Regulation
02/07/2019 07:30,UK,476),,BOE's Carney speaks at press conference in London
02/12/2019 08:00,UK,477),,BOE Governor Carney Speaks in London
02/14/2019 04:30,UK,478),,BOE's Vlieghe Speaks on the Economic Outlook
02/26/2019 05:00,UK,479),,"BOE's Carney, Ramsden, Vlieghe, Haskel at Parliament Committee"
03/05/2019 10:35,UK,480),,BOE Governor Mark Carney Testifies to House of Lords
03/06/2019 07:15,UK,481),,BOE's Cunliffe speaks in London
03/06/2019 12:30,UK,482),,BOE's Saunders Speaks in London
03/07/2019 04:00,UK,483),,BOE's Tenreyro Speaks in Glasgow
03/11/2019 09:00,UK,484),,BOE's Haskel Speaks in Birmingham
03/21/2019 12:15,UK,485),,BOE's Carney Speaks in Brussels on Sustainable Finance
03/26/2019 07:00,UK,486),,BOE's Broadbent Speaks on Statistics in London
03/28/2019 09:30,UK,487),,"BOE's Carney Speaks at Investing Conference, London"
04/10/2019 11:05,UK,488),,BOE's Ramsden Speaks on Panel in Washington
04/10/2019 15:45,UK,489),,BOE's Carney Speaks on Panel in Washington
04/11/2019 12:30,UK,490),,BOE Governor Mark Carney appears on panel in Washington
04/11/2019 14:15,UK,491),,"BOE's Cunliffe, Norway's Jensen Speak on Panel in Washington"
04/12/2019 12:30,UK,492),,BOE Governor Mark Carney Appears on Panel at IMF
04/15/2019 12:00,UK,493),,BOE's Haskel Chairs a Panel at Event in Warwick
04/17/2019 09:00,UK,494),,"BOE's Carney, BOF's Villeroy de Galhau Speak in Paris"
04/23/2019 09:30,UK,495),,U.K. Parliament Returns From Easter Recess
04/26/2019,UK,496),,United Kingdom Sovereign Debt to be rated by S&P
04/26/2019,UK,497),,United Kingdom Sovereign Debt to be rated by Fitch
04/29/2019 04:10,UK,498),,Bank of England Governor Carney Speaks in London
04/30/2019 03:40,UK,499),,BOE Deputy Governor Ramsden Speaks in London
05/01/2019 04:30,EC,500),,ECB Vice President Guindos Speaks in London
05/02/2019 01:00,UK,501),,U.K. Local Elections
05/02/2019 07:30,UK,502),,BOE's Carney speaks at press conference in London
05/07/2019 05:20,UK,503),,BOE's Cunliffe speaks in London.
05/07/2019 12:30,UK,504),,BOE's Haldane speaks in Sheffield.
05/08/2019 04:15,UK,505),,BOE's Ramsden speaks in London.
05/16/2019 13:30,UK,506),,BOE's Jonathan Haskel speaks in York
05/17/2019 08:00,UK,507),,BOE's Alex Brazier speaks in London
05/17/2019,UK,508),,United Kingdom Sovereign Debt to be rated by Moody's
05/20/2019 12:30,UK,509),,BOE's Ben Broadbent speaks in London
05/23/2019 01:00,UK,510),,European Parliament Elections
05/30/2019 03:30,UK,511),,"BOE's Dave Ramsden speaks in Inverness, Scotland"
06/05/2019 03:45,UK,512),,BOE's Dave Ramsden Speaks in London
06/06/2019 05:00,UK,513),,BOE Governor Mark Carney Speaks in Tokyo
06/07/2019,UK,514),,Theresa May Steps Down as U.K. Conservative Party Leader
06/08/2019 06/09,UK,515),,Chancellor Philip Hammond attends G20 Finance Meeting in Japan
06/10/2019 05:30,UK,516),,BOE's Haldane speaks in London.
06/10/2019 13:00,UK,517),,BOE's Saunders speaks in Southampton.
06/10/2019,UK,518),,U.K. Conservative Party Begins Contest to Choose New Leader
06/11/2019 05:00,UK,519),,"BOE's Saunders, Broadbent speak in Parliament."
06/13/2019,UK,520),,Conservative Party leadership ballot to narrow down candidates
06/14/2019 08:55,UK,521),,BOE Governor Mark Carney speaks in London.
06/14/2019,UK,522),,United Kingdom Sovereign Debt to be rated by DBRS
06/18/2019,UK,523),,Conservative Party leadership ballot to narrow down candidates
06/19/2019,UK,524),,Conservative Party leadership ballot to narrow down candidates
06/20/2019,UK,525),,Conservative Party leadership ballot to narrow down candidates
06/21/2019 08:30,UK,526),,BOE's Tenreyro Speaks in Copenhagen
06/26/2019 05:15,UK,527),,"BOE's Carney, Cunliffe, Tenreyro and Saunders Speak"
07/02/2019 10:05,UK,528),,BOE's Carney Speaks in Bournemouth.
07/03/2019 06:00,PO,529),,BOE's Cunliffe Speaks in Lisbon.
07/03/2019 08:15,UK,530),,BOE's Broadbent speaks in London.
07/10/2019 13:10,UK,531),,BOE's Tenreyro speaks in London
07/11/2019 05:30,UK,532),,BOE publishes Financial Stability Report.
07/11/2019 06:00,UK,533),,BOE Governor Carney speaks at press conference
07/12/2019 04:00,UK,534),,BOE's Vlieghe speaks in London.
07/16/2019 08:00,UK,535),,BOE's Carney speaks on panel in Paris.
07/17/2019 06:30,UK,536),,"G-7 Finance Officials Meet in Chantilly, France"
07/18/2019 06:30,UK,537),,"G-7 Finance Officials Meet in Chantilly, France"
07/22/2019 07/28,UK,538),,Conservatives to name new Prime Minister after party vote
08/01/2019 07:30,UK,539),,BOE's Carney speaks at press conference in London
08/23/2019 15:00,UK,540),,BOE's Carney Speaks at Jackson Hole
08/27/2019 08:00,UK,541),,"ECB's De Guindos, BOE's Tenreyro Speak on Monetary Policy"
09/04/2019 09:15,UK,542),,"BOE's Carney, Haldane, Haskel and Vlieghe Speak in Parliament"
09/05/2019 10:30,EC,543),,BOE's Tenreyro Speaks in Frankfurt
09/09/2019 04:00,UK,544),,BOE's Vlieghe Speaks in London
09/09/2019,UK,545),,U.K. Lawmakers Vote Again on Early General Election
09/19/2019 05:00,EC,546),,OECD Publishes Interim Economic Outlook
09/23/2019 05:15,UK,547),,BOE's Tenreyro Speaks at ECB Conference in Frankfurt
09/25/2019 09:05,UK,548),,BOE Governor Carney Moderates Climate Change Panel
09/25/2019 11:15,UK,549),,BOE Governor Carney Speaks on Climate Risk Panel in New York
09/26/2019 09:45,EC,550),,BOE Deputy Governor Cunliffe Speaks in Frankfurt
09/27/2019 03:00,UK,551),,BOE's Saunders Speaks in Barnsley
10/03/2019 10:00,UK,552),,BOE's Tenreyro Speaks on Panel in Washington
10/08/2019 00:00,UK,553),,BOE's Carney Speaks on Climate Change in Tokyo
10/08/2019 05:30,UK,554),,BOE's Tenreyro Speaks on Panel in Frankfurt
10/14/2019 08:10,UK,555),,BOE's Cunliffe Speaks on Monetary Policy in London
10/15/2019 04:30,UK,556),,BOE Governor Mark Carney Speaks In Parliamentary Testimony
10/15/2019 08:30,UK,557),,BOE's Vlieghe Speaks on Monetary Policy in London
10/16/2019 10:00,UK,558),,BOE's Carney Takes Part in Panel Discussion at IMF Event
10/16/2019 18:00,UK,559),,BOE's Carney Speaks at Event at Harvard Kennedy School
10/18/2019 13:45,UK,560),,BOE Governor Carney Speaks in Washington
10/18/2019 17:15,UK,561),,BOE's Cunliffe Speaks on Panel in Washington
10/18/2019,UK,562),,United Kingdom Sovereign Debt to be rated by Fitch
10/21/2019 11:00,UK,563),,BOE's Haldane Speaks on Diversity in Frankfurt
10/25/2019,UK,564),,United Kingdom Sovereign Debt to be rated by S&P
10/28/2019 13:00,UK,565),,BOE's Tenreyro speaks in London.
10/29/2019 14:00,UK,566),,Carney Speaks at CFA Institute 2019 Annual Conference:
11/04/2019 09:30,UK,567),,U.K. House of Commons holds election for new speaker
11/07/2019 07:30,UK,568),,BOE's Carney speaks at press conference in London
11/08/2019,UK,569),,United Kingdom Sovereign Debt to be rated by Moody's
11/14/2019 04:45,EC,570),,ECB's Guindos Speaks in London
11/25/2019 13:00,EC,571),,ECB's Lane Speaks in London
12/12/2019,UK,572),,U.K. General Election
12/13/2019,UK,573),,United Kingdom Sovereign Debt to be rated by DBRS
12/16/2019 04:30,UK,574),,Office for Budget Responsibility publishes new forecasts
12/16/2019 12:00,UK,575),,"BOE Publishes Financial Stability Report, Stress Tests"
12/16/2019 12:30,UK,576),,BOE's Carney Speaks at FSR Press Conference in London
12/17/2019 14:15,UK,577),,BOE's Carney Speaks at Coeure's Farewell Dinner
12/18/2019 05:00,UK,578),,Bank of England Publishes Paper on Climate Risks
12/20/2019 06:00,UK,579),,BOE's Haskel Speaks in London
01/05/2020 05:15,UK,580),,BOE's Broadbent Speaks on Panel in San Diego
01/07/2020,UK,581),,Parliament Returns From Recess
01/08/2020 05:30,UK,582),,BOE's Haldane Speaks on U.K. Regional Inequality in Amsterdam
01/09/2020 04:30,UK,583),,BOE Governor Carney Speaks in London
01/10/2020 04:30,UK,584),,BOE's Tenreyro Speaks on the Labor Market Outlook in London
01/15/2020 03:40,UK,585),,"BOE's Saunders Speaks in Bangor, Northern Ireland"
01/21/2020 10:00,UK,586),,BOE Governor Carney Speaks on Panel at Davos
01/22/2020 02:40,UK,587),,BOE's Carney Speaks at Bloomberg Climate Forum in Davos
01/24/2020 04:30,UK,588),,BOE Policy Maker Jonathan Haskel Speaks on Panel in Davos
01/24/2020 05:30,EC,589),,"WEF: Lagarde, Zhu, Mnuchin, Scholz, Georgieva, Kuroda, Javid"
01/30/2020 07:30,UK,590),,BOE's Carney speaks at press conference in London
02/11/2020 06:30,UK,591),,BOE's Jon Cunliffe speaks in Berlin
02/11/2020 10:35,UK,592),,BOE Governor Carney Speaks Before Lords Committee
02/11/2020 12:00,UK,593),,BOE Policy Maker Haskel Speaks in Nottingham
02/21/2020 13:30,UK,594),,BOE's Tenreyro Speaks on Panel in New York
02/24/2020 13:30,UK,595),,BOE Chief Economist Haldane Speaks in London
02/27/2020 05:30,UK,596),,BOE's Cunliffe Speaks on a Panel in London
02/28/2020 06:15,UK,597),,BOE Chief Economist Haldane Speaks in Oxford
02/28/2020 11:15,UK,598),,BOE's Cunliffe speaks in London.
03/04/2020 13:00,UK,599),,Bank of England Deputy Governor Ben Broadbent Speaks in London
03/05/2020 12:00,UK,600),,BOE's Carney Speaks in London.
03/11/2020 08:30,UK,601),,U.K. Government Announces 2020 Budget
03/27/2020,UK,602),,United Kingdom Sovereign Debt to be rated by Fitch
04/16/2020 09:30,UK,603),,BOE's Tenreyro Speaks on Monetary Policy During Pandemics
04/17/2020,UK,604),,United Kingdom Sovereign Debt to be rated by Moody's
04/20/2020 04:30,UK,605),,BOE's Haldane and Broadbent hold briefing.
04/23/2020 05:30,UK,606),,BOE's Vlieghe Speaks on Policy and the Balance Sheet
04/24/2020,UK,607),,United Kingdom Sovereign Debt to be rated by S&P
05/07/2020 05:00,UK,608),,BOE Publishes Briefing With Governor Bailey
05/11/2020 08:00,UK,609),,BOE's Breeden Speaks on Webinar
05/14/2020 06:30,UK,610),,BOE Governor Bailey Speaks on Webinar
05/18/2020 11:00,UK,611),,BOE's Tenreyro Speaks About Covid-19 Response on Webinar
05/20/2020 09:30,UK,612),,"BOE's Bailey, Broadbent, Cunliffe Speak at Treasury Committee"
05/26/2020 05:00,UK,613),,BOE's Haldane Speaks on CBI Webinar
05/28/2020 06:00,UK,614),,BOE's Saunders speaks.
06/12/2020,UK,615),,United Kingdom Sovereign Debt to be rated by DBRS
06/18/2020 09:00,UK,616),,"BOE's Broadbent, Tenreyro, Speak on Virtual Panel"
06/23/2020 04:45,UK,617),,BOE Governor Bailey Speaks at Women in Finance Event
06/25/2020 13:00,UK,618),,BOE's Haldane Speaks on the Future of Society
06/29/2020 05:30,UK,619),,"BOE's Bailey, Breeden Speak at Climate Financial Risk Forum"
06/29/2020 05:30,UK,620),,BOE Governor Andrew Bailey Speaks at Climate Finance Event
06/29/2020 08:30,UK,621),,"BOE's Vlieghe Speaks on Macroeconomic Tail Risk, Asset Prices"
06/30/2020 06:00,UK,622),,BOE Chief Economist Andrew Haldane Speaks in Webinar
06/30/2020 10:00,UK,623),,BOE's Cunliffe Speaks on Central Banking in the Covid-19 Age
07/01/2020 07:00,UK,624),,BOE Policy Maker Haskel Speaks on Webinar
07/07/2020 13:00,UK,625),,BOE's Haldane Speaks on Webcast
07/08/2020 07:30,UK,626),,U.K. Chancellor Sunak Delivers Statement on Economy
07/13/2020 09:00,UK,627),,BOE Governor Bailey Speaks at Virtual Schools Event
07/13/2020 11:30,UK,628),,BOE Governor Bailey Speaks on Libor
07/15/2020 04:00,UK,629),,BOE's Tenreyro Speaks on Covid-19 and the Economy
07/15/2020 09:30,UK,630),,U.K. Chancellor Sunak Appears Before Treasury Committee
07/16/2020 07:15,UK,631),,BOE Governor Bailey Speaks on Financial Education
07/17/2020 06:00,UK,632),,BOE Governor Bailey Speaks on Webinar
07/20/2020 11:10,UK,633),,BOE's Haldane and Tenreyro Speak at Re-Appointment Hearings
07/23/2020 07:00,UK,634),,BOE's Haskel Speaks the Economic Effects of Covid-19
08/26/2020 12:00,UK,635),,BOE's Haldane speaks in Edinburgh.
08/28/2020 09:05,UK,636),,BOE Governor Bailey Speaks at Jackson Hole Symposium
09/01/2020 05:30,UK,637),,Publication of the new Bank of England Agenda for Research
09/02/2020 09:00,UK,638),,"BOE's Bailey, Ramsden and Vlieghe Speak at TSC"
09/02/2020 10:30,UK,639),,BOE's Broadbent and Haldane Speak
09/03/2020 10:00,UK,640),,BOE's Bailey Speaks on Cryptocurrencies
09/03/2020 10:00,UK,641),,BOE's Ramsden Speaks at Conference
09/04/2020 05:30,UK,642),,BOE's Saunders Speaks
09/07/2020 10:15,UK,643),,BOE's Haskel Speaks at a European Commission Event
09/22/2020 03:30,UK,644),,BOE's Bailey Speaks on BCC Webinar
09/24/2020 10:00,UK,645),,BOE's Bailey Speaks at Chamber of Commerce Event
09/24/2020,UK,646),,U.K.s Sunak Delivers Statement on Job Protection
09/25/2020,UK,647),,United Kingdom Sovereign Debt to be rated by Fitch
10/05/2020 04:30,UK,648),,BOE's Haldane speaks.
10/05/2020 09:25,UK,649),,BOE's Haskel speaks.
10/09/2020 10:30,UK,650),,BOE's Haldane Speaks at OECD Conference
10/12/2020 10:00,UK,651),,BOE's Haskel Speaks at Online Event
10/12/2020 12:00,UK,652),,BOE's Bailey Speaks on Panel
10/14/2020 09:30,UK,653),,BOE's Broadbent Speaks at Public Accounts Committee
10/14/2020 12:00,UK,654),,BOE's Haldane Speaks
10/15/2020 09:00,UK,655),,BOE's Cunliffe Speaks
10/16/2020,UK,656),,United Kingdom Sovereign Debt to be rated by Moody's
10/18/2020 09:05,UK,657),,BOE's Bailey Speaks at G30 International Banking Seminar
10/19/2020 09:30,UK,658),,"BOE's Broadbent, John Speak on Cash"
10/19/2020 10:05,UK,659),,BOE's Cunliffe Speaks at Fintech Event
10/19/2020 11:00,UK,660),,BOE's Cunliffe Speaks at IMF Events on Cross-Border Payments
10/20/2020 05:30,UK,661),,BOE's Vlieghe Speaks on Health of the Economy
10/21/2020 08:10,UK,662),,BOE's Ramsden Speaks at SPE Event
10/22/2020 04:30,UK,663),,BOE's Haldane Speaks at Macroeconomics Conference
10/22/2020 05:25,UK,664),,BOE's Bailey Speaks at Conference
10/23/2020 10:00,UK,665),,BOE's Ramsden Chairs Event on Financial Stability
10/23/2020,UK,666),,United Kingdom Sovereign Debt to be rated by S&P
11/06/2020 07:15,UK,667),,"BOE's Broadbent, Ramsden Speak About Monetary Policy Report"
11/09/2020 05:35,UK,668),,BOE Governor Andrew Bailey speaks.
11/09/2020 09:00,UK,669),,BOE's Andy Haldane speaks.
11/12/2020 03:00,UK,670),,BOE Governor Andrew Bailey Speaks
11/12/2020 11:00,UK,671),,BOE Deputy Governor Cunliffe Speaks
11/12/2020 11:45,EC,672),,"ECB's Lagarde, BOE's Bailey, Fed's Powell Speak at ECB Forum"
11/13/2020 08:00,UK,673),,BOE Deputy Governor Cunliffe Speaks
11/13/2020 09:00,UK,674),,BOE's Silvana Tenreyro Speaks
11/16/2020 12:30,UK,675),,BOE's Haskel Speaks on AI Technologies
11/17/2020 06:15,UK,676),,BOE Governor Andrew Bailey Speaks
11/17/2020 12:00,UK,677),,BOE's Dave Ramsden Speaks
11/18/2020 05:30,UK,678),,BOE's Andy Haldane Speaks
11/18/2020 11:30,UK,679),,BOE Governor Bailey Speaks
11/23/2020 10:30,UK,680),,"BOE's Bailey, Haldane, Tenreyro, Saunders Speak"
11/24/2020 06:00,UK,681),,BOE's Haskel Speaks on Panel
11/30/2020 09:30,UK,682),,BOE's Tenreyro Speaks
12/01/2020 09:00,UK,683),,BOE Governor Bailey Speaks on Panel
12/02/2020 13:00,UK,684),,BOE's Haskel speaks.
12/04/2020 04:30,UK,685),,BOE's Saunders Speaks
12/04/2020 08:45,UK,686),,BOE's Tenreyro Speaks on Webinar
12/11/2020 02:00,UK,687),,BOE Publishes Financial Stability Report
12/11/2020,UK,688),,United Kingdom Sovereign Debt to be rated by DBRS
01/06/2021 09:00,UK,689),,BOE's Bailey Speaks at Parliament Committee on FSR
01/11/2021 09:00,UK,690),,BOE's Tenreyo Speaks at UWE Bristol Event
01/12/2021 05:00,UK,691),,BOE's Broadbent Speaks on Covid and Spending
01/15/2021,UK,692),,United Kingdom Sovereign Debt to be rated by Fitch
01/18/2021 08:30,UK,693),,BOE Governor Bailey Speaks With Lord Stern on Climate
01/19/2021 13:00,UK,694),,BOE's Haldane In Conversation With Lord Rusbridger
01/20/2021 12:00,UK,695),,BOE's Bailey and Brazier Take Question From Citizens' Panel
01/25/2021 12:00,UK,696),,BOE's Bailey Speaks at World Economic Forum Event
02/05/2021 07:15,UK,697),,"BOE's Bailey, Ramsden and Haldane speak."
02/05/2021 08:30,UK,698),,"BOE's Bailey, ECB's Guindos Speak on Post Covid Recovery"
02/10/2021 08:00,EC,699),,ECB's Lagarde Speaks at Online Seminar
02/17/2021 11:00,UK,700),,BOE's Ramsden Speaks on Quantitative Easing
02/18/2021 06:00,UK,701),,BOE's Saunders Speaks on Webinar
02/18/2021 07:00,UK,702),,Bank of England's Vlieghe Speaks
02/22/2021 13:00,UK,703),,BOE's Vlieghe Delivers Pre-Published Speech
02/24/2021 07:00,UK,704),,BOE's Haldane Speaks at BOE Seminar on Changing World of Work
02/24/2021 09:30,UK,705),,"BOE's Bailey, Broadbent, Vlieghe and Haskel Speak"
